<?xml version='1.0' encoding='UTF-8'?>
<!--
  Licensed to the Apache Software Foundation (ASF) under one or more
  contributor license agreements.  See the NOTICE file distributed with
  this work for additional information regarding copyright ownership.
  The ASF licenses this file to You under the Apache License, Version 2.0
  (the "License"); you may not use this file except in compliance with
  the License.  You may obtain a copy of the License at

  http://www.apache.org/licenses/LICENSE-2.0

  Unless required by applicable law or agreed to in writing, software
  distributed under the License is distributed on an "AS IS" BASIS,
  WITHOUT WARRANTIES OR CONDITIONS OF ANY KIND, either express or implied.
  See the License for the specific language governing permissions and
  limitations under the License.
-->
<xsd:schema xmlns:xsd="http://www.w3.org/2001/XMLSchema" targetNamespace="urn:activemq" xmlns="urn:activemq"
            elementFormDefault="qualified" attributeFormDefault="unqualified" version="1.0">

   <xsd:element name="configuration">
      <xsd:complexType>
         <xsd:sequence>
            <xsd:element name="mask-password" type="xsd:boolean" maxOccurs="1" minOccurs="0"></xsd:element>
            <xsd:element name="password-codec" type="xsd:string" maxOccurs="1" minOccurs="0"></xsd:element>
            <xsd:element name="defaultuser" type="userType" maxOccurs="1" minOccurs="0"></xsd:element>
            <xsd:element name="user" type="userType" maxOccurs="unbounded" minOccurs="0"></xsd:element>
         </xsd:sequence>
      </xsd:complexType>
   </xsd:element>

   <xsd:element name="role">
      <xsd:complexType>
         <xsd:attribute name="name" type="xsd:string" use="required"></xsd:attribute>
      </xsd:complexType>
   </xsd:element>

   <xsd:complexType name="userType">
      <xsd:sequence>
         <xsd:element ref="role" maxOccurs="unbounded" minOccurs="1"></xsd:element>
      </xsd:sequence>
      <xsd:attribute name="name" type="xsd:ID" use="required"></xsd:attribute>
      <xsd:attribute name="password" type="xsd:string"></xsd:attribute>
   </xsd:complexType>
</xsd:schema>
