<configuration xmlns="urn:activemq" xmlns:xsi="http://www.w3.org/2001/XMLSchema-instance"
            xsi:schemaLocation="urn:activemq /schema/activemq-users.xsd">
   
   <user name="bill" password="activemq">
      <role name="user"/>
   </user>
  
   <user name="andrew" password="activemq1">
      <role name="europe-user"/>
      <role name="user"/>
   </user>
   
   <user name="frank" password="activemq2">
      <role name="us-user"/>
      <role name="news-user"/>
      <role name="user"/>
   </user>
   
   <user name="sam" password="activemq3">
      <role name="news-user"/>
      <role name="user"/>
   </user>

</configuration>

